{"$defs":{"source":{"additionalProperties":false,"properties":{"block_id":{"enum":["GLOBAL_TYPED","GLOBAL_DESCENT","GRADED_CELLULAR","COMPLETE_CARRIER","COMPLETE_QUADRATURE","CPT_ORIENTATION"]},"relative_path":{"minLength":1,"type":"string"},"source_sha256":{"pattern":"^[0-9a-f]{64}$","type":"string"},"span":{"items":false,"maxItems":2,"minItems":2,"prefixItems":[{"minimum":0,"type":"integer"},{"minimum":0,"type":"integer"}],"type":"array"},"span_sha256":{"pattern":"^[0-9a-f]{64}$","type":"string"}},"required":["block_id","relative_path","source_sha256","span","span_sha256"],"type":"object"}},"$id":"urn:rd22:step11:orientation-unitary-proof:v001","$schema":"https://json-schema.org/draft/2020-12/schema","additionalProperties":false,"properties":{"carrier":{"type":"object"},"checks":{"items":{"type":"object"},"minItems":7,"type":"array"},"conclusions":{"type":"object"},"gaps":{"const":[]},"proof_id":{"const":"P_ORIENTATION_UNITARY_AND_COMPLETE_HK_SQUARE"},"schema":{"const":"rd22.step11.orientation-unitary-proof.v001"},"source_bindings":{"items":{"$ref":"#/$defs/source"},"minItems":4,"type":"array"},"status":{"const":"KERNEL_READY"}},"required":["schema","proof_id","carrier","source_bindings","checks","conclusions","status","gaps"],"type":"object"}