{"carrier":{"byte_length":3088,"relative_path":"step11_orientation_unitary/generated/7c19430b1346cf6aab1a217f634add352bfc8e55cf3e2f7d87fc2d1f2f9f841f--U_CELL_ORIENTATION_CANONICAL.json","sha256":"7c19430b1346cf6aab1a217f634add352bfc8e55cf3e2f7d87fc2d1f2f9f841f"},"checks":[{"check":"UNITARY","identity":"U_c^* U_c=I_3","result":[[[1,0],[0,0],[0,0]],[[0,0],[1,0],[0,0]],[[0,0],[0,0],[1,0]]],"success":true},{"check":"SELF_ADJOINT_INVOLUTION","identity":"U_c^*=U_c=U_c^-1","success":true},{"check":"RECORD_ODDNESS","identity":"Gamma_cell b_partial+b_partial Gamma_cell=0","result":[[[0,0],[0,0],[0,0]],[[0,0],[0,0],[0,0]],[[0,0],[0,0],[0,0]]],"success":true},{"check":"ORIENTATION_BOUNDARY","identity":"d_rev=-d and b_rev=-b","success":true},{"check":"LOCAL_CONJUGATION","identity":"U_c c_c U_c^*=c_(rev c)=-c_c","result":[[[0,0],[0,0],[0,1]],[[0,0],[0,0],[0,-1]],[[0,-1],[0,1],[0,0]]],"success":true},{"check":"SOURCE_PROJECTOR","identity":"P_c(-d_c)=P_c(d_c)","success":true},{"check":"COMPLETE_HK_SQUARE","identity":"h_(rev_O K)=U_O h_K U_O^*","success":true,"termwise":{"reversed_cells":"c_c -> -c_c; P_c fixed","unreversed_cells":"separate tensor factors commute with U_O"}}],"conclusions":{"complete_hK":"h_(rev_O K)=U_O h_K U_O^* for every finite selected subset O","local":"U_c c_c U_c^*=c_(rev c)=-c_c","typed_carrier":"U_c=Gamma_cell=diag(+1,+1,-1):R_c->R_c"},"gaps":[],"proof_id":"P_ORIENTATION_UNITARY_AND_COMPLETE_HK_SQUARE","schema":"rd22.step11.orientation-unitary-proof.v001","source_bindings":[{"block_id":"GLOBAL_TYPED","relative_path":"review_packets/STAGE7_QSPEC_CANDIDATE_V001/BID_GLOBAL_BOUNDARY_DESCENT_QUASI_FREE_COMPLETENESS_V001.md","source_sha256":"949181d78aca143ebef06eacc4ab1018d43cdf79962ee8c78c350f654a7555dd","span":[1103,1704],"span_sha256":"daeb7bc7b448e78009703e6fc7a7946a76844f7ee6f479327e63ab6ab84057d2"},{"block_id":"GLOBAL_DESCENT","relative_path":"review_packets/STAGE7_QSPEC_CANDIDATE_V001/BID_GLOBAL_BOUNDARY_DESCENT_QUASI_FREE_COMPLETENESS_V001.md","source_sha256":"949181d78aca143ebef06eacc4ab1018d43cdf79962ee8c78c350f654a7555dd","span":[1705,4005],"span_sha256":"fcbb16c6cad76b08a210d55d42a1ce82d165ae3a0adfd63f28ba16f30946d1ce"},{"block_id":"GRADED_CELLULAR","relative_path":"review_packets/STAGE7_QSPEC_CANDIDATE_V001/BID_GRADED_BOUNDARY_SUPERCONNECTION_REPAIR_V001.md","source_sha256":"2215f79cbe69f1de1643427ad5d422b0c3064ff758327e43ff1629de8633f72d","span":[344,1501],"span_sha256":"10262d72110ffaafdcaf4ea0419af4f780b1616e30567a9275c0b1315207ef72"},{"block_id":"COMPLETE_CARRIER","relative_path":"review_packets/STAGE7_QSPEC_CANDIDATE_V001/BID_COMPLETE_ONE_NORMAL_ZERO_FORM_ENUMERATION_V001.md","source_sha256":"50b5a651df2aca90ee47c6f85b2a502461370a652706ebccad871f191565a2d9","span":[386,1377],"span_sha256":"191cf84d2288f532f7d4df410be2c8947ffa006c4bc440a697a4120a9e6f1fde"},{"block_id":"COMPLETE_QUADRATURE","relative_path":"review_packets/STAGE7_QSPEC_CANDIDATE_V001/BID_COMPLETE_ONE_NORMAL_ZERO_FORM_ENUMERATION_V001.md","source_sha256":"50b5a651df2aca90ee47c6f85b2a502461370a652706ebccad871f191565a2d9","span":[3909,4583],"span_sha256":"42188aeee574da63e53aa88a0204f472d59b377c959eb2f6439602d692eb9a7c"},{"block_id":"CPT_ORIENTATION","relative_path":"review_packets/STAGE7_QSPEC_CANDIDATE_V001/BID_CHARGED_CELLULAR_CPT_INTERTWINER_DERIVATION_V001.md","source_sha256":"0322763ac48a4428b432124a6947da81826a41f612efa6803ee9a87317929b98","span":[4185,5830],"span_sha256":"c9fc62a999110e443f87551110e914462029f2dd5a5dd331d7ca202cd894b6c5"}],"status":"KERNEL_READY"}